Item_ID	Sentence	Adj	Noun
18:55	however, debra messing later realized that in posting an image of solely vaginas she had excluded trans women “ who do n’t have a vagina.	trans	women
29:11	although many trans women undergo surgery to remove their penis and replace it with an artificially constructed vagina, a large number also keep their genital organs intact.	trans	women
34:35	nbc news published a transgender “ health and wellness ” story about biological females who identify as males, yet must deal with normal menstruation.	biological	females
35:8	for transgender men, pain of menstruation is more than just physical.	transgender	men
38:37	the article attempted to highlight the “ physical and psychological pain ” biological females who claim to be male experience when they get their normal monthly periods.	biological	females
196:99	” a similar bill did not advance last year, but several supporters of the measure said they were convinced to vote for it after university of pennsylvania swimmer lia thomas, a trans woman, won a title earlier this month at the national ncaa women ’s division i championship.	trans	woman
254:114	” in november, walker resigned from her position at old dominion university, claiming that her research was “ mischaracterized by some in the media and online, ” in part, due to her being a transgender biological woman.	biological	woman
261:30	news reports that a 33 -- year -- old transgender woman who worked as a software engineer in seattle has been arrested in relation to a massive data breach which puts over 100 million capital one credit card applicants at risk.	transgender	woman
281:37	” last summer, valentina sampaio made headlines after becoming the first biological man to appear in sports illustrated ’s annual swimsuit issue.	biological	man
288:73	but according to carrera, that ’s not enough, as the rupaul ’s drag race star calls that tokenism, and believes that more biological men that identify as women should dominate the magazine covers.	biological	men
289:26	“ it ’s great to see trans women, especially trans women of color, get on a global, recognizable platform like si swim, ” carrera said.	trans	women
289:37	“ it ’s great to see trans women, especially trans women of color, get on a global, recognizable platform like si swim, ” carrera said.	trans	women
449:63	rachel levine, pennsylvania ’s secretary of health, is still a man regardless of any claim to be a “ transgender woman, ” says jenna ellis, a senior legal adviser for president donald trump ’s reelection campaign.	transgender	woman
463:35	it ’s not just my belief that dr. levine is a biological male.	biological	male
491:66	we ’re seeing all kinds of challenges with the transgender movement because, you know, you ’re seeing that biological men are … harming women.	biological	men
492:90	there was the case out of alaska where a battered woman shelter was sued to try to have a transgender, quote unquote, woman — but a biological man — be placed overnight with biological women.	biological	man
492:109	there was the case out of alaska where a battered woman shelter was sued to try to have a transgender, quote unquote, woman — but a biological man — be placed overnight with biological women.	biological	women
520:73	a pentagon report commissioned by former defense secretary james mattis said that “ rates for genital surgery are exceedingly low -- 2% of transgender men and 10% of transgender women.	transgender	men
520:89	a pentagon report commissioned by former defense secretary james mattis said that “ rates for genital surgery are exceedingly low -- 2% of transgender men and 10% of transgender women.	transgender	women
633:59	sir keir starmer, the labour party leader, declared on friday that he is a staunch believer that “ trans women are women ”.	trans	women
646:62	sir keir has claimed he believes in “ safe spaces for women ”, but as he believes ‘ trans women are women ’ it seems unlikely that this extends to safe spaces for biological women.	trans	women
646:109	sir keir has claimed he believes in “ safe spaces for women ”, but as he believes ‘ trans women are women ’ it seems unlikely that this extends to safe spaces for biological women.	biological	women
847:16	sophie cook, a transgender woman who advised mr cairns on the change in policy said: “ like the bigots of the past, the anti-semites and the homophobes, the anti-transgender lobby is gradually fading.	transgender	woman
903:71	a pentagon report commissioned by former defense secretary james mattis said “ rates for genital surgery are exceedingly low -- 2% of transgender men and 10% of transgender women.	transgender	men
903:87	a pentagon report commissioned by former defense secretary james mattis said “ rates for genital surgery are exceedingly low -- 2% of transgender men and 10% of transgender women.	transgender	women
962:90	it contains well -- known alternate options, such as “ agender ” — used to describe someone who does not have a gender — “ transgender, ” “ trans woman, ” “ trans man, ” “ non-binary, ” and “ intersex, ” but it also includes less commonly known options.	trans	woman
962:101	it contains well -- known alternate options, such as “ agender ” — used to describe someone who does not have a gender — “ transgender, ” “ trans woman, ” “ trans man, ” “ non-binary, ” and “ intersex, ” but it also includes less commonly known options.	trans	man
1025:81	voters reward leaders who stand up to woke bullies, particularly those who seek to inject age -- inappropriate gender ideology in classrooms and allow biological men to compete in women ’s sports, rep. jim banks --lrb- r -- in --rrb- said tuesday.	biological	men
1034:45	“ we ’re seeing ncaa especially cheapen women ’s sports by allowing biological men to compete in women ’s sports, ” he said, noting that it appears holcomb caved to pressure from the ncaa, which is headquartered in indianapolis.	biological	men
1040:93	a speaker at a women ’s march in savannah, georgia, on saturday said the fight for the right to kill unborn children in the womb also applies to “ trans men.	trans	men
1041:65	” “ this is an issue that has been affecting moms, their daughters, their granddaughters, their great granddaughters, trans men — it ’s been affecting people for 50 years because even though it ’s legal, we ’re still fighting for it, which does n’t make sense, ” the speaker said to a crowd of several hundred people at forsyth park.	trans	men
1055:82	the bill asserts that access to abortion is “ critical to the health of every person capable of becoming pregnant, ” including “ cisgender women, transgender men, non-binary individuals, those who identify with a different gender, and others.	transgender	men
1182:26	tennis great martina navratilova reiterated her stand against biological males competing against natural -- born women, because the males have a competitive edge.	biological	males
1273:130	so, stop me if you ’ve heard this one before: biological male who decides he ’s a woman, gets permission to compete in women ’s athletics, and then proceeds to use his natural physical advantages to dominate all the biological females.	biological	females
1279:14	” usav requires transgender women to undergo hormone replacement therapy consistently for at least one year — with proper documentation — and they also have to change their identification, like passports and birth certificates, to female.	transgender	women
1283:76	players and parents we spoke to who did not want to be on camera say it ’s not fair for teams with biological women because it creates an unrealistic level of competition.	biological	women
1292:41	” she also said that karen white — a biologically -- male ‘ trans woman ’ who was jailed for violent crimes and rape and was moved to a man ’s prison after sexually assaulting fellow female inmates — was a “ man ” and spoke out about the danger to women if men are allowed to self -- identify and have this used as the legal standard as it could lead to more women being harmed.	trans	woman
1296:71	according to the times, she is believed to be the first person in britain to lose her job for saying that trans women were not women.	trans	women
1315:67	homeless shelters designed to house females now have protections so that women do n’t have to share intimate spaces with biological men who “ identify ” as women, according to a new rule issued on friday by u.s. housing and urban development --lrb- hud --rrb-.	biological	men
1322:64	“ hud secretary ben carson had previously expressed concern about the impact on residents of female -- only shelters when transgender women are allowed to share bathrooms and shower areas, ” the post reported.	transgender	women
1324:92	“ the rule cites a lawsuit against anchorage, in which a faith -- based shelter claimed that female residents said they ’d rather sleep in the woods than alongside biological males, ” the post reported.	biological	males
1343:31	” in addition, teen vogue insists that a “ trans woman is a woman ” in the video says.	trans	woman
1420:105	in nevada, tulsi gabbard --lrb- on behalf of adam laxalt --rrb- attacks democrat sen. catherine cortez masto for going along with woke ideologues who “ demonize police, support open borders, and believe biological men should compete against women in sports.	biological	men
1425:106	in particular, the campaign focused on drawing attention to woke efforts to encourage and enable children to undergo irreversible and dangerous sex -- change procedures, inject sexually explicit content into schools, and allow biological males in female sports.	biological	males
1456:110	just last year, the green party ’s own parliamentary candidate for cambridge, rupert read, was asked to step down when he was labeled “ transphobic ” for arguing in an academic article that transgender women were “ a sort of ‘ opt -- in ’ version of what it is to be a woman ”.	transgender	women
1493:64	big thanks to#liathomas for saving women ’s sports by showing just how preposterous it is for a strapping athletic young biological man to compete with biological women.	biological	man
1493:79	big thanks to#liathomas for saving women ’s sports by showing just how preposterous it is for a strapping athletic young biological man to compete with biological women.	biological	women
1505:55	“ i told my fellow officials that i can no longer participate in a sport which allows biological men to compete against women.	biological	men
1547:42	the female hygiene company tampax decided on sunday to express support for biological women who want to live as men by posting on social media that biological sex does n’t determine who has menstrual cycles.	biological	women
1584:10	as a trans woman, i want equality.	trans	woman
1673:80	simon fanshawe argued stonewall should not minimise the concerns of women who object to transgenders competing in female -- only sports or oppose letting biological males into female -- only spaces such as changing rooms and bathrooms.	biological	males
1691:41	” ros -- lehtinen ’s daughter, reports the washington post, is a transgender man and a lgbt activist.	transgender	man
1704:14	thomas, a biological male who has taken record wins in the 100 -- yard and 200 -- yard freestyle races and has easily beaten all natural -- born opponents after joining the university ’s women ’s swim team this season, has become the focus of criticism throughout the season.	biological	male
1707:15	lia thomas, a transgender woman, dives into the water to swim in the 200 yard medley relay for the university of pennsylvania at an ivy league swim meet against harvard university in cambridge, massachusetts, on january 22, 2022.	transgender	woman
1714:15	lia thomas, a transgender woman --lrb- c --rrb-, gathers with her teammates before she swims for the university of pennsylvania at an ivy league swim meet against harvard university in cambridge, massachusetts, on january 22, 2022.	transgender	woman
1904:86	” australian -- born feminist germaine greer accused glamour of “ misogyny ” in its decision to award jenner its woman of the year award, noting that transgender women are “ not women ” and do not “ look like, sound like or behave like women.	transgender	women
1926:22	” “ if i were that trans man, i would really want to have language that incorporated and included my experience, ” cox added.	trans	man
1930:20	” for me, as a trans woman, i ca n’t get pregnant.	trans	woman
2059:27	however, there are some intersex men and trans men who may get pregnant.	trans	men
2060:25	“ we can include intersex men and trans men who may get pregnant by saying “ pregnant people ” instead of “ expectant mothers.	trans	men
2071:36	the owners and editors of sports illustrated are betting that a transgender man on the cover of their 2021 swimsuit edition will change heterosexual attitudes, shift the magazine ’s public image, and help their imminent initial public offering --lrb- ipo --rrb- on wall street.	transgender	man
2097:14	here ’s a trans woman, and a straight man.	trans	woman
2100:60	it ’s a very real story and one that i ’ve lived over and over again, and many trans women have lived, dealing with toxic masculinity every fucking second of our fucking lives, and trying to navigate it and being empathetic and giving people a chance.	trans	women
2157:106	in a discussion with yahoo finance, a man living as a woman and a woman who is living as a man said it is fair for transgender ‘ women ’ to compete against biological women and that claims otherwise are “ overblown.	biological	women
2161:28	“ it ’s absolutely fair to have trans women and girls competing in every level of sport — which we have had for decades, ” @aclu deputy dir.	trans	women
2166:18	the facts about the advantage transgender women have over biological women are well -- documented, including in the lawsuit filed by high school athletes in connecticut challenging the state ’s athletic association for allowing it.	transgender	women
2166:29	the facts about the advantage transgender women have over biological women are well -- documented, including in the lawsuit filed by high school athletes in connecticut challenging the state ’s athletic association for allowing it.	biological	women
2201:74	the ideology claims that “ gender identity ” is independent of sexual desire — so a heterosexual man can declare himself to be a “ transgender woman, ” complete with a “ female penis.	transgender	woman
2251:58	” if a lesbian is in a relationship with a woman who declares herself to be a transgender man, then transgender activists relabel the lesbian as a “ straight ” heterosexual woman.	transgender	man
2310:65	the times doubled down this month, leading the charge for the radical transgender agenda by directing readers to recognize a biological male who identifies as a woman, amy schneider, as the “ first woman ” to win$ 1 million on jeopardy! “ on friday, she became the fourth contestant and the first woman in the history of ‘ jeopardy! ’ to surpass$ 1 million in winnings during regular -- season play, ” the times wrote, continually referring to the biological male as “ she.	biological	male
2310:249	the times doubled down this month, leading the charge for the radical transgender agenda by directing readers to recognize a biological male who identifies as a woman, amy schneider, as the “ first woman ” to win$ 1 million on jeopardy! “ on friday, she became the fourth contestant and the first woman in the history of ‘ jeopardy! ’ to surpass$ 1 million in winnings during regular -- season play, ” the times wrote, continually referring to the biological male as “ she.	biological	male
2316:90	thomas performed unremarkably for nearly three years in the men ’s category on the u penn team but took a year off before returning this season to compete as a transgender woman on the school ’s women ’s team.	transgender	woman
2321:64	big thanks to#liathomas for saving women ’s sports by showing just how preposterous it is for a strapping athletic young biological man to compete with biological women.	biological	man
2321:79	big thanks to#liathomas for saving women ’s sports by showing just how preposterous it is for a strapping athletic young biological man to compete with biological women.	biological	women
2327:83	lohn to feel that the ncaa ’s requirements for transgender people are “ not nearly stringent enough to create a level playing field between thomas and the biological females against whom she is racing.	biological	females
2329:23	the effects of being born a biological male, as they relate to the sport of swimming, offer thomas a clear -- cut edge over the biological females against whom she is competing.	biological	male
2329:82	the effects of being born a biological male, as they relate to the sport of swimming, offer thomas a clear -- cut edge over the biological females against whom she is competing.	biological	females
2338:45	for the good of the sport, and for fairness to those competing as biological women, a ruling must come down soon.	biological	women
2509:79	some feminists are urging participants in the women ’s march this year to ditch their pink pussyhats for fear they may be offensive to those biological men who claim to be women and to people of color.	biological	men
2524:42	” nevertheless, zweiman says she is open to listening to those biological men who claim to be women and people of color who are apparently insulted by the pink pussyhat.	biological	men
2531:67	” “ this type of feminism, though hugely successful in terms of reproductive justice, ultimately emphasized a mistreatment of transgender women that continues today, ” the pensacola organization said.	transgender	women
2532:13	“ though some transgender women do choose to have genital reconstruction surgery, many do not, and should not have to prove their sic being a woman.	transgender	women
2610:144	rowling has herself become a frequent target of radical transgender activists, claiming to have been the victim of numerous death threats as well as having the adress for her family home doxxed on social media in response to her advocacy for women ’s rights and opposition to biological male transgender people trying to encroach on them.	biological	male
2668:47	“ women lose out on a fair playing field when forced to compete against biological men, ” gleim said.	biological	men
2723:56	“ in our opinion, the study by madsen et al. in jcem hides the true numbers of trans males at risk for high red blood cell counts and therefore cardiovascular harms, ” the authors write at website gender sanity.	trans	males
2731:20	females who identify as trans males are given very high doses of testosterone to attempt to bring their testosterone levels into the male range.	trans	males
2732:23	“ women who identify as trans males are being given very high, very risky doses of testosterone, ” laidlaw explained to breitbart news about his concerns.	trans	males
2739:81	” in the study we have critiqued, the authors use what is considered very high hemoglobin levels in males --lrb- greater than 50 --rrb- for trans males --lrb- females --rrb-.	trans	males
2747:53	“ not only that, it ’s also dangerous because doctors will miss a large number of trans males who are risking heart attacks and death from testosterone.	trans	males
2751:57	laidlaw and his colleagues instead “ propose that the female reference range for hemoglobin and hematocrit be used for trans males so that both clinicians and patients can help more accurately assess risk factors for cardiovascular disease and death.	trans	males
2756:28	jeopardy! is awarding women ’s records to a transgender man, and corporate parent nbc news is hailing amy schneider as the “ highest -- earning female contestant in the game show ’s nearly 57 -- year run.	transgender	man
2785:16	“ i am a trans woman, and i ’m proud of that fact, ” she tweeted, “ but i ’m a lot of other things, too!	trans	woman
2879:17	“ i am a trans woman, and i ’m proud of that fact, but i ’m a lot of other things, too!	trans	woman
2954:53	her presence in the oval office would in no way forward that goal any more than a biological man in the oval office would.	biological	man
2957:40	that ’s why feminist thinker germaine greer declared identifying as a transgender woman “ meaningless ” and a “ delusion ”: if gender is as changeable as a suit of clothing, womanhood means nothing.	transgender	woman
3019:55	but some of the “ women ” the show celebrates are n’t women — one is a biological male who performs as a drag queen, while another is transgender.	biological	male
3080:25	” “ it ’s not about excluding transgender women from winning ever, ” navratilova said.	transgender	women
3094:31	we will protect women ’s sports by banning biological males from competing.	biological	males
3119:33	he referred to the scandal of lia thomas, a transgender woman swimmer for the university of pennsylvania, saying, “ so ridiculous.	transgender	woman
3132:44	most americans, including the vast majority of republicans, are in agreement that biological males should not have access to women ’s spaces or be able to compete in women ’s sports.	biological	males
3168:35	noem supporting legislation to protect women from competing against biological men who consider themselves transgender women, according to a poll.	biological	men
3168:51	noem supporting legislation to protect women from competing against biological men who consider themselves transgender women, according to a poll.	transgender	women
3236:15	jesse is a transgender man who works in a job with two slightly different sets of uniforms; one set is usually issued to men and the other is usually issued to women.	transgender	man
3260:87	” women athletes, feminists, and christians have joined forces to speak out about the harm to women that comes from forcing them to compete against biological men who want to live as women, or “ transgender women.	biological	men
3260:118	” women athletes, feminists, and christians have joined forces to speak out about the harm to women that comes from forcing them to compete against biological men who want to live as women, or “ transgender women.	transgender	women
3326:30	“ the protests essentially objected to pyne, a transgender woman, competing in the women ’s events, ” reported kxan.	transgender	woman
3343:106	sen. elizabeth warren --lrb- d -- ma --rrb- used her closing statement to express disappointment in some of the topics avoided during tuesday night ’s debate, lamenting the lack of conversation on “ how trans women, particularly trans women of color, are at risk.	trans	women
3343:117	sen. elizabeth warren --lrb- d -- ma --rrb- used her closing statement to express disappointment in some of the topics avoided during tuesday night ’s debate, lamenting the lack of conversation on “ how trans women, particularly trans women of color, are at risk.	trans	women
3394:51	with the importance of testosterone in mind, the international olympic committee ruled in 2015 that trans women would be allowed to compete in women ’s events provided that they took drugs to suppress their testosterone levels for at least a year before the competition.	trans	women
3395:37	the hope was that would remove the male advantage, allowing trans women to compete in their preferred category while keeping things fair for the biological females against whom they would be competing.	trans	women
3395:79	the hope was that would remove the male advantage, allowing trans women to compete in their preferred category while keeping things fair for the biological females against whom they would be competing.	biological	females
3401:52	last year, such evidence persuaded world rugby that it was both unsafe and unfair to let trans women play in the international women ’s game.	trans	women
3404:28	eight u.s. states have recently enacted laws banning biological males from competing in girls ’ and women ’s sports.	biological	males
3547:35	” japanese soccer player kumi yokoyama said tuesday she was a transgender male.	transgender	male
3673:45	the sports world reacted on monday to news that transgender cyclist rachel mckinnon, a biological male, had smashed even more women ’s cycling records.	biological	male
3701:16	leyna bloom, a biological man who identifies as a woman, has become the first openly trans cover model in sports illustrated swimsuit issue history.	biological	man
3782:46	these women alleged that the shelter enabled sexual harassment against them by allowing a biological male who identified as a female to enter the homeless shelter.	biological	male
3783:7	the biological male showered with the females, where the individual would “ repeatedly make lewd and sexually inappropriate comments to some of the plaintiffs, ” and “ stare and leer at the plaintiffs while naked and make sexually harassing comments about their bodies.	biological	male
3784:48	” in its defense, the shelter alleged that it was required to admit the biological male because a person self -- identified as a female, and hud ’s 2016 rule did not give the shelter flexibility to allow for different treatment.	biological	male
3785:94	… the hope center in anchorage, alaska, a faith -- based women ’s shelter, filed a federal lawsuit challenging a local law that would require them to serve biological males who identify as females.	biological	males
