Item_ID	Sentence	Adj	Noun
17751:83	the recent book irreversible damage by abigail shrier documents how many schools and doctors are providing drugs and mastectomies to minor girls who have decided they are transgender men, often without the informed consent of parents.	transgender	men
17908:12	” another transgender woman added, “ i love breitbart and your kkk readers ’ comments.	transgender	woman
17913:7	the transgender woman was referring to the recent houston ballot issue.	transgender	woman
17923:23	nikki describes herself as a “ heterosexual trans woman.	trans	woman
17930:49	” his wife nikki said, “ the whole anti-hero became a series of attacks on transgender women that we are the predators.	transgender	women
17936:30	veronika simms described herself as a republican, christian, transgender woman.	transgender	woman
18020:110	a conservative group notes polling data shows an eight -- point swing in voters ’ shift to incumbent gop kentucky gov. matt bevin from democrat candidate andy beshear after they view ads highlighting beshear ’s support of biological men competing in women ’s sports.	biological	men
18032:30	a recent study in sweden has shown that biological males who claim to be transgender women still retained considerable advantages over biological females in strength and muscle mass, even after a full year of hormone therapy.	biological	males
18032:50	a recent study in sweden has shown that biological males who claim to be transgender women still retained considerable advantages over biological females in strength and muscle mass, even after a full year of hormone therapy.	transgender	women
18032:70	a recent study in sweden has shown that biological males who claim to be transgender women still retained considerable advantages over biological females in strength and muscle mass, even after a full year of hormone therapy.	biological	females
18033:67	in another study, researchers concluded that male athletes who claim to be female hold an “ intolerable ” advantage over biological female athletes.	biological	female
18034:69	three professors — two in bioethics and one in physiology — noted the international olympic committee --lrb- ioc --rrb- is allowing “ transgender women ” to compete against biological females if their testosterone is below 10 nmol / l. however, even that level is “ significantly higher ” than that of biological females, they asserted.	transgender	women
18034:86	three professors — two in bioethics and one in physiology — noted the international olympic committee --lrb- ioc --rrb- is allowing “ transgender women ” to compete against biological females if their testosterone is below 10 nmol / l. however, even that level is “ significantly higher ” than that of biological females, they asserted.	biological	females
18034:156	three professors — two in bioethics and one in physiology — noted the international olympic committee --lrb- ioc --rrb- is allowing “ transgender women ” to compete against biological females if their testosterone is below 10 nmol / l. however, even that level is “ significantly higher ” than that of biological females, they asserted.	biological	females
18050:68	biden has also set a goal of ending the hiv epidemic — which disproportionately affects gay and bisexual men as well as transgender women — by 2025, five years ahead of the goal set by president donald trump during his state of the union address this year.	transgender	women
18070:20	“ a#loud,#angry#black#trans#woman ” is more affective than a#dead one.	#trans	#woman
18114:67	however, dr. oz ’s spokesperson said that he is, indeed, a conservative who “ does n’t believe biological men should play women ’s sports ” — a major social issue.	biological	men
18115:31	yet, when asked about lia thomas, the biological male at the university of pennsylvania who has been smashing women ’s records, the candidate said we “ have to have compassion ” for transgender adults.	biological	male
18249:15	“ as a black transgender woman, i ’ve often been kept a secret by the men that i ’ve dated, ” cox said in a video accompanying the shoot.	transgender	woman
18254:19	several influential magazines have included transgender women on their covers for the first time in recent months, including vogue paris, and playboy, which introduced its first transgender “ playmate ” in october.	transgender	women
18269:41	a new effort has been launched to stop transgender “ women, ” biological males, from competing against natural -- born female athletes.	biological	males
18380:124	the panel opted to rule against townsend despite her highlighting in january that she was merely trying to “ stand up for women ” with her initial tweet as well as highlighting she does “ support the right of trans men and women to live how they choose ”.	trans	men
18741:9	a transgendered man ‘ identifying ’ as a woman, who was sentenced to a term in a male jail, has been moved to an all female prison.	transgendered	man
18783:59	former president donald trump used his cpac speech in florida to sharply criticize the democrats ’ unified push to get transgender men into women ’s sports.	transgender	men
18788:61	now younger girls and women are incensed that they are being forced to compete against those who are biological males.	biological	males
18817:50	a public policy professor at georgia state university is speaking out about the debate on whether biological men who “ identify ” as women, or transgender women, should be allowed to compete against biological females.	biological	men
18817:78	a public policy professor at georgia state university is speaking out about the debate on whether biological men who “ identify ” as women, or transgender women, should be allowed to compete against biological females.	transgender	women
18817:104	a public policy professor at georgia state university is speaking out about the debate on whether biological men who “ identify ” as women, or transgender women, should be allowed to compete against biological females.	biological	females
18820:51	in connecticut, three female athletes have filed suit against the state ’s athletic group for allowing transgender females to compete against female athletes in the states ’ high schools.	transgender	females
18896:87	while the new guidelines lay out the legal protections of transgender and “ gender -- nonconforming ” new yorkers, they make no provisions for women who would prefer biological males not share their lavatories or locker rooms.	biological	males
18942:79	” j.k. rowling, meanwhile, has remained at the center of the debate after publicly questioning radical transgender ideology and the impact it has on biological women.	biological	women
19011:67	the idaho senate voted monday to approve the fairness in women ’s sports act --lrb- hb 500a --rrb-, which would ban biological males who identify as female from competing on girls ’ and women ’s athletic teams.	biological	males
19067:45	some transgender activists have falsely claimed there is no scientific evidence that suggests biological males identifying as females have an unfair advantage over biological female athletes.	biological	males
19067:75	some transgender activists have falsely claimed there is no scientific evidence that suggests biological males identifying as females have an unfair advantage over biological female athletes.	biological	female
19068:65	however, as breitbart news reported, a recent study conducted by the karolinska institute and linkoping university in sweden found biological males — who claim to be transgender women — who were administered a full year of hormone therapy, still maintained muscle mass and strength advantages over biological women.	biological	males
19068:88	however, as breitbart news reported, a recent study conducted by the karolinska institute and linkoping university in sweden found biological males — who claim to be transgender women — who were administered a full year of hormone therapy, still maintained muscle mass and strength advantages over biological women.	transgender	women
19068:147	however, as breitbart news reported, a recent study conducted by the karolinska institute and linkoping university in sweden found biological males — who claim to be transgender women — who were administered a full year of hormone therapy, still maintained muscle mass and strength advantages over biological women.	biological	women
19071:77	“ our results indicate that after 12 months of hormonal therapy, a transwoman will still likely have performance benefits over a cis -- woman biological woman, ” they concluded.	biological	woman
19072:119	in another study published at bmj and released in july, three professors — two in bioethics and one in physiology — concluded that male athletes who claim to be female hold an “ intolerable ” advantage over biological female athletes.	biological	female
19073:54	the study was conducted after the international olympic committee --lrb- ioc --rrb- announced it would allow “ transgender women ” to compete against biological females if their testosterone is below 10 nmol / l. however, even that level is “ significantly higher ” than that of biological females, the authors said.	transgender	women
19073:71	the study was conducted after the international olympic committee --lrb- ioc --rrb- announced it would allow “ transgender women ” to compete against biological females if their testosterone is below 10 nmol / l. however, even that level is “ significantly higher ” than that of biological females, the authors said.	biological	females
19073:141	the study was conducted after the international olympic committee --lrb- ioc --rrb- announced it would allow “ transgender women ” to compete against biological females if their testosterone is below 10 nmol / l. however, even that level is “ significantly higher ” than that of biological females, the authors said.	biological	females
19157:91	chiara canaan, 22, a founder of the pique resilience project with three other young women who experienced rapid -- onset gender dysphoria --lrb- rogd --rrb-, identified as a “ trans man ” when she was 16, but then “ detransitioned ” at 19.	trans	man
19169:19	“ identifying as a ‘ trans man ’ set me back years in accepting my own sexuality, ” she explained.	trans	man
19197:80	in june, for example, a skewed poll by arizona state university ’s global sport institute showed 53 percent oppose allowing men who consider themselves transgender women to compete against biological women, with only 26 percent supporting it.	transgender	women
19197:96	in june, for example, a skewed poll by arizona state university ’s global sport institute showed 53 percent oppose allowing men who consider themselves transgender women to compete against biological women, with only 26 percent supporting it.	biological	women
19385:89	men have a clear legal right to display their “ male -- appearing genitalia ” at children and women in health spas, as long as the men say they are transgender women, and especially when objectors are “ bigots, ” according to a condescending editorial in the los angeles times.	transgender	women
19457:18	the move comes after biological male offender karen white, who was jailed for multiple violent rapes, sexually assaulted multiple female inmates within weeks of being sent to a women ’s prison.	biological	male
19463:99	a large proportion of activists ’ ire was focused on alleging the decision sends the “ shocking ” and “ bigoted ” message that there are differences between female -- identifying transgender people and biological women, with one user lamenting that the move to create a separate jail “ is just heartbreaking and awful regardless of what these women were accused of ”.	biological	women
19601:69	three professors — two in bioethics and one in physiology — noted the international olympic committee --lrb- ioc --rrb- was allowing “ transgender women ” to compete against biological females if their testosterone is below 10 nmol / l. however, even that level is “ significantly higher ” than that of biological females, they asserted.	transgender	women
19601:86	three professors — two in bioethics and one in physiology — noted the international olympic committee --lrb- ioc --rrb- was allowing “ transgender women ” to compete against biological females if their testosterone is below 10 nmol / l. however, even that level is “ significantly higher ” than that of biological females, they asserted.	biological	females
19601:156	three professors — two in bioethics and one in physiology — noted the international olympic committee --lrb- ioc --rrb- was allowing “ transgender women ” to compete against biological females if their testosterone is below 10 nmol / l. however, even that level is “ significantly higher ” than that of biological females, they asserted.	biological	females
19611:30	” she continued, “ they falsely claim trans women automatically have more testosterone and therefore more muscle mass than cis women.	trans	women
19633:22	scots who pronounce that transgender women are not actually women will face criminal prosecution under the impending hate crime legislation if a court finds that their speech “ stirred up hatred ”, justice secretary humza yousaf said.	transgender	women
19634:81	on monday, mr yousaf tried to defend the draconian speech restrictions, telling the scottish parliament ’s justice committee that expressing the idea that “ a trans woman is not a woman ” is not “ in itself is not going to lead to a prosecution under this legislation ”.	trans	woman
19715:68	declaring these leaders have, “ blood on their hands ” for their supposed role in the murders of various trans women and ethnic minorities.	trans	women
19779:32	it asks for broad tolerance for the reality that transgender men and women exist, and are entitled to basic human dignity, just like everyone else.	transgender	men
19963:91	president donald trump ’s new policy on sex and gender is a big defeat for the campaign by progressives and transgender activists to eliminate any civic or legal distinctions between biological females and biological males.	biological	females
19963:98	president donald trump ’s new policy on sex and gender is a big defeat for the campaign by progressives and transgender activists to eliminate any civic or legal distinctions between biological females and biological males.	biological	males
20166:85	yet, now it is holding division 1 softball regional tournaments in three states — alabama, arkansas, and tennessee — which recently passed bills that bar biological males who “ identify ” as female from competing against biological women.	biological	males
20166:118	yet, now it is holding division 1 softball regional tournaments in three states — alabama, arkansas, and tennessee — which recently passed bills that bar biological males who “ identify ” as female from competing against biological women.	biological	women
20187:79	state lawmakers in florida are poised to reject legislation that would put in place a law to protect female athletes from competing against biological men who consider themselves transgender, according to politico.	biological	men
20250:55	cox ’s skillful performance as sophia on orange is the new black and her work advocating for transgender women make her one of our boldest beauties yet.	transgender	women
20285:29	here, the school district prohibited n.h., a transgender male, from using the boys ’ main locker room.	transgender	male
20426:24	at least nine transgender individuals — seven biological men and two biological women — hope to compete at the olympics in july in tokyo.	biological	men
20426:33	at least nine transgender individuals — seven biological men and two biological women — hope to compete at the olympics in july in tokyo.	biological	women
20506:31	the law has caused some controversy because it forbids transgender men and boys from using women ’s public bathrooms and locker rooms if they self -- identify as female.	transgender	men
20567:27	alarmingly, judge coney barrett has referred to transgender women as “ physiological males ” and made public statements against same -- sex marriage.	transgender	women
20604:42	among the invitees to the white house are a pro-abortion religious sister, a transgender woman and the first openly gay episcopal bishop, along with at least two catholic gay activists.	transgender	woman
20645:57	evelyn telfer, a reproductive biologist at the university of edinburgh, is leading the effort to help biological women who are living as transgender men — many of whom used hormones to bring on male characteristics — create offspring in the laboratory.	biological	women
20645:78	evelyn telfer, a reproductive biologist at the university of edinburgh, is leading the effort to help biological women who are living as transgender men — many of whom used hormones to bring on male characteristics — create offspring in the laboratory.	transgender	men
20646:39	the mit technology review reported on the development, including saying that transgender men are “ assigned female at birth: ” for the first time, scientists say they have managed to take eggs from the ovaries of transgender men and get them ready for fertilization in a process completed entirely outside the body.	transgender	men
20646:118	the mit technology review reported on the development, including saying that transgender men are “ assigned female at birth: ” for the first time, scientists say they have managed to take eggs from the ovaries of transgender men and get them ready for fertilization in a process completed entirely outside the body.	transgender	men
20647:36	the achievement … suggests that viable eggs can be obtained from transgender men even after years of testosterone therapy, which can stop ovulation.	transgender	men
20648:16	this would allow transgender men who want children to avoid having to pause gender -- affirming medical care and avoid vaginal probes, women ’s health clinics, and female -- hormone -- based treatments, all of which can be physically or emotionally distressing.	transgender	men
20654:24	the procedure can be particularly distressing for transgender men.	transgender	men
20658:22	subjects in this project included transgender men who had been taking testosterone and were undergoing surgery that included the removal of their ovaries and were asked to donate them for research.	transgender	men
20790:62	” in january 2019, shupe released a “ public announcement ” in which he declared he had resumed his biological male sex designation.	biological	male
20825:31	shupe took estrogen when he identified as a transgender female, but stopped short of having sex -- change surgeries.	transgender	female
20855:70	in 2017 the nba pulled its all -- star game from the state of north carolina when that state passed a law preventing biological men from using female restrooms.	biological	men
20879:130	rep. greg steube --lrb- r -- fl --rrb- also blasted the bill, telling breitbart news that it reflects the radical agenda of the democrats, redefining “ what a woman is and what a man is and it would allow biological men to play girls and women ’s sports.	biological	men
20993:37	the swearing -- in this week of sarah mcbride, the first transgender woman to become a member of the delaware state senate, inspired taxpayer -- funded national public radio --lrb- npr --rrb- to interview imara jones, a transgender woman who rejects the assertion that there are two biological sexes.	transgender	woman
20993:112	the swearing -- in this week of sarah mcbride, the first transgender woman to become a member of the delaware state senate, inspired taxpayer -- funded national public radio --lrb- npr --rrb- to interview imara jones, a transgender woman who rejects the assertion that there are two biological sexes.	transgender	woman
21002:71	” jones is referring to a growing number of states that are seeking laws to protect female athletes from competing against biological men who have chosen to be transgender women.	biological	men
21002:94	” jones is referring to a growing number of states that are seeking laws to protect female athletes from competing against biological men who have chosen to be transgender women.	transgender	women
21193:139	the update comes as transgender activists continue to push the envelope as they forcefully reject the reality of biological sex and push society to accept their premise that gender is fluid — a move critics say effectively erases women, as activists push to allow biological men to compete in women sports.	biological	men
21197:32	however, that position blatantly sidesteps biological reality, as biological women are the only sex that menstruates, regardless of gender identity.	biological	women
21204:53	ezra furman and the harpoons singer ezra furman took to instagram to come out as “ a trans woman and a mom, ” and insisted that “ this is possible.	trans	woman
21205:43	” “ i wanted to share with everyone that i am a trans woman, and also that i am a mom and have been for a while now, ” furman wrote in an instagram caption on tuesday.	trans	woman
21209:34	furman recalled seeing “ approximately zero examples ” of “ trans women raising children.	trans	women
21211:18	” “ i ’m a trans woman and a mom.	trans	woman
21229:70	the first person in china to openly undergo gender -- changing surgery is 53 -- year -- old tv host jin xing, a biological male who became “ china ’s oprah winfrey ” after undergoing transition surgery in 1995.	biological	male
21267:111	the official journal of the international society of psychoneuroendocrinology published a paper from the max planck institute of psychiatry in munich that found male -- to -- female transsexuals have similar second and fourth finger lengths to biological women.	biological	women
21425:103	layt told afp of a life playing rugby before and after transition, a three -- year process involving hormones and finally surgery in 1998 and now rugby league ’s decision to exclude transgender women is “ really disappointing.	transgender	women
21677:42	“ women must accept and admit that there is no material difference between trans women and themselves.	trans	women
21712:10	the “ transgender woman of colour ” was fired by the uk branch of the cosmetic company after their comments came to light on social media.	transgender	woman
21759:20	megan youngren, 29, a biological male who identifies as a transgender female will compete in the trials as a female, according to the daily mail.	biological	male
21759:39	megan youngren, 29, a biological male who identifies as a transgender female will compete in the trials as a female, according to the daily mail.	transgender	female
21760:58	youngren, who reportedly came out as transgender in 2012, is set to compete against 63 biological women for a spot on the 2020 u.s. olympics team for this year ’s summer games.	biological	women
21781:12	currently, a transgender female athlete must have testosterone below ten nanomoles per liter for at least 12 months before competition and must remain below that threshold during the period of competition.	transgender	female
21889:44	transgender activists have attacked sweden ’s first women -- only festival for only banning biological men, as this could imply transgendered men are not real men.	biological	men
21889:66	transgender activists have attacked sweden ’s first women -- only festival for only banning biological men, as this could imply transgendered men are not real men.	transgendered	men
21894:7	are transgender men less male?	transgender	men
21896:37	a different user noted that “ you have previously argued that transgender men know how it is to be vulnerable and oppressed, just like women, and should, therefore, be welcomed.	transgender	men
21944:40	leading doctors have said they back nhs -- funded womb transplants for biological males who identify as women, a procedure which experts say will be possible within 10 years.	biological	males
21985:32	on thursday, at london ’s thundcrit cycling event, two biological males identifying as women took first and second place and then celebrated their “ achievement ” by kissing on the podium as the third -- place winner, an actual female, held her baby.	biological	males
21992:62	according to the website, this category is reserved for “ cis -- women, non-binary people, ” as well as “ trans men and women whose physical performance aligns most closely with cis -- women.	trans	men
22049:63	the group is planning to propose federal legislation to codify protections for girl and women athletes from competing against biological men in sports while creating a way for transgender competition.	biological	men
22072:29	“ thus, proposing federal legislation to protect biological females and create a women ’s sports environment that is welcoming, respectful and celebratory for trans girls and women is only one small step.	biological	females
22158:37	like the national collegiate athletic association, some high -- school associations allow transgender females to participate on girls ’ teams if they meet certain conditions, such as completing a period of testosterone -- suppression treatment or gender -- reassignment surgery.	transgender	females
22160:30	the lawmakers cite advantages that males competing as transgender women have over biological females, including differences in muscle mass, bone strength, lung capacity, and heart size — all differences that can not be changed by hormone therapy or surgery.	transgender	women
